<?xml version="1.0" encoding="UTF-8"?>
<deployer xmlns="http://moyarada.com/schemas/Deployer_1.0" xmlns:xsi="http://www.w3.org/2001/XMLSchema-instance"
	xsi:schemaLocation="http://moyarada.com/schemas/Deployer_1.0 ../classes/Deployer_1.0.xsd">

	<!-- REMEMBER to update Schema once you added/deleted something from config -->
    <project>My example project</project>
	<verbose>false</verbose>
	<!-- Temporary directory where all work is performed, relative -->
	<targetDir>tmp/deployer</targetDir>
	<!-- Where your project directory located, absolute path, or relative to scripts 
		directory -->
	<sourceDir>.</sourceDir>
	<localDeploymentDir></localDeploymentDir>
	<remoteDeploymentDir></remoteDeploymentDir>

	<transports>
		<tranport name="ProdServer">
			<type>SFTP</type>
			<login></login>
			<password></password>
			<host></host>
			<port></port>
			<fingerprints>
				<fingerprint></fingerprint>
			</fingerprints>
			<pubKeyPath></pubKeyPath>
			<privKeyPath></privKeyPath>
		</tranport>

		<tranport name="DevServer">
			<type>FTP</type>
			<login></login>
			<password></password>
			<host></host>
			<port></port>
		</tranport>

	</transports>


	<!-- Relative to sourceDir -->
	<items>
		<!-- Copy recursivelly the entire directory -->
		<item>application</item>
		<item>libs/lib1</item>
		
		<!-- Copy only this file. all directories in path will be created -->
		<item>templates/index/index.phtml</item>
		<item>templates/layouts</item>
		
	</items>

</deployer>